{
    "$schema": "http://json-schema.org/draft-07/schema#",
    "$id": "https://qualcomm.github.io/tac/schemas/pinout-1.0.json",
    "title": "TAC Pinout",
    "description": "Shared hardware pinout and automation script for a QTAC debug board. Language-neutral, externally-consumable half of a configuration; the UI overlay lives in a sibling *.tcnf that references it via 'pinout_ref'. Tools should verify 'format' == 'tac-pinout' before relying on the contents.",
    "type": "object",
    "required": [
        "format", "schema_version", "platform_id", "platform_type", "name",
        "description", "usb_descriptor", "reset_enabled", "script", "pins", "variables"
    ],
    "additionalProperties": false,
    "properties": {
        "$schema":              { "type": "string" },
        "format":               { "const": "tac-pinout" },
        "schema_version":       { "const": "1.0" },
        "platform_id":          { "type": "integer", "minimum": 0 },
        "platform_type":        { "type": "string", "enum": ["FTDI", "FT232H", "PSOC", "PIC32CXAuto", "STM32"] },
        "name":                 { "type": "string", "minLength": 1 },
        "description":          { "type": "string" },
        "usb_descriptor":       { "type": "string" },
        "reset_enabled":        { "type": "boolean" },
        "chip_count":           { "type": "integer", "minimum": 1 },
        "bus":                  { "$ref": "#/definitions/bus" },
        "pins":                 { "$ref": "#/definitions/pins" },
        "variables":            { "$ref": "#/definitions/variables" },
        "supportedFirmwareVer": { "type": "array", "items": { "type": "integer", "minimum": 1 } },
        "script":               { "type": "string" }
    },
    "if":   { "properties": { "platform_type": { "enum": ["FTDI", "FT232H"] } } },
    "then": { "required": ["chip_count", "bus"] },
    "else": {
        "if":   { "properties": { "platform_type": { "const": "PSOC" } } },
        "then": { "required": ["supportedFirmwareVer"] }
    },
    "definitions": {
        "pins": {
            "type": "array",
            "items": {
                "oneOf": [
                    { "$ref": "#/definitions/ftdi_pin" },
                    { "$ref": "#/definitions/psoc_pin" },
                    { "$ref": "#/definitions/pic32cx_pin" },
                    { "$ref": "#/definitions/stm32_pin" }
                ]
            }
        },
        "ftdi_pin": {
            "type": "object",
            "required": [
                "chip_index", "bus", "pin_number", "command",
                "input", "inverted", "initial_value", "priority"
            ],
            "additionalProperties": false,
            "properties": {
                "chip_index":    { "type": "integer", "minimum": 0 },
                "bus":           { "type": "string", "enum": ["A", "B", "C", "D"] },
                "pin_number":    { "type": "string" },
                "command":       { "type": "string" },
                "input":         { "type": "boolean" },
                "inverted":      { "type": "boolean" },
                "initial_value": { "type": "boolean" },
                "priority":      { "type": "integer" }
            }
        },
        "psoc_pin": {
            "type": "object",
            "required": [
                "pin_number", "command", "inverted",
                "initial_value", "initialization_priority", "classic_action"
            ],
            "additionalProperties": false,
            "properties": {
                "pin_number":              { "type": "string" },
                "command":                 { "type": "string" },
                "inverted":                { "type": "boolean" },
                "initial_value":           { "type": "boolean" },
                "initialization_priority": { "type": "integer" },
                "classic_action":          { "type": "string" }
            }
        },
        "pic32cx_pin": {
            "type": "object",
            "required": ["pin_number", "command", "inverted"],
            "additionalProperties": false,
            "properties": {
                "pin_number": { "type": "integer", "minimum": 0 },
                "command":    { "type": "string" },
                "inverted":   { "type": "boolean" }
            }
        },
        "stm32_pin": {
            "type": "object",
            "required": ["pin", "command", "inverted"],
            "additionalProperties": false,
            "properties": {
                "pin":      { "type": "string" },
                "command":  { "type": "string" },
                "inverted": { "type": "boolean" }
            }
        },
        "bus": {
            "type": "array",
            "items": {
                "type": "object",
                "required": ["bus", "bus_function", "chip_index"],
                "additionalProperties": false,
                "properties": {
                    "bus":          { "type": "string", "enum": ["A", "B", "C", "D"] },
                    "bus_function": { "type": "integer" },
                    "chip_index":   { "type": "integer", "minimum": 0 }
                }
            }
        },
        "variables": {
            "type": "array",
            "items": {
                "type": "object",
                "required": ["name", "default_value"],
                "additionalProperties": false,
                "properties": {
                    "name":          { "type": "string", "minLength": 1 },
                    "default_value": { "type": "string" }
                }
            }
        }
    }
}
