{
    "$schema": "https://qualcomm.github.io/tac/schemas/pinout-1.0.json",
    "description": "SHIKRA PSOC",
    "format": "tac-pinout",
    "name": "SHIKRA PSOC",
    "pins": [
        {
            "classic_action": "TAC_SOFT_RESET",
            "command": "eud",
            "initial_value": false,
            "initialization_priority": -1,
            "inverted": false,
            "pin_number": "15"
        },
        {
            "classic_action": "TC_EUD_EARLY_BOOT_EN",
            "command": "uim1",
            "initial_value": false,
            "initialization_priority": -1,
            "inverted": true,
            "pin_number": "16"
        },
        {
            "classic_action": "TAC_UIM1_DIS",
            "command": "uim2",
            "initial_value": false,
            "initialization_priority": -1,
            "inverted": true,
            "pin_number": "18"
        },
        {
            "classic_action": "TAC_UIM2_DIS",
            "command": "uim2",
            "initial_value": false,
            "initialization_priority": -1,
            "inverted": false,
            "pin_number": "19"
        },
        {
            "classic_action": "TAC_HEADSET_DIS",
            "command": "headset",
            "initial_value": false,
            "initialization_priority": -1,
            "inverted": false,
            "pin_number": "21"
        },
        {
            "classic_action": "",
            "command": "",
            "initial_value": false,
            "initialization_priority": -1,
            "inverted": false,
            "pin_number": "29"
        },
        {
            "classic_action": "TAC_FORCE_USB_BOOT_SEC",
            "command": "sedl",
            "initial_value": false,
            "initialization_priority": -1,
            "inverted": false,
            "pin_number": "30"
        },
        {
            "classic_action": "TAC_RESET_SEC",
            "command": "sresn",
            "initial_value": false,
            "initialization_priority": -1,
            "inverted": false,
            "pin_number": "31"
        },
        {
            "classic_action": "TAC_VOL_UP",
            "command": "volup",
            "initial_value": false,
            "initialization_priority": -1,
            "inverted": false,
            "pin_number": "34"
        },
        {
            "classic_action": "TAC_USB1_DIS",
            "command": "usb1",
            "initial_value": false,
            "initialization_priority": 2,
            "inverted": false,
            "pin_number": "36"
        },
        {
            "classic_action": "TAC_FORCE_PS_HOLD",
            "command": "pshold",
            "initial_value": false,
            "initialization_priority": -1,
            "inverted": false,
            "pin_number": "37"
        },
        {
            "classic_action": "",
            "command": "",
            "initial_value": false,
            "initialization_priority": -1,
            "inverted": false,
            "pin_number": "38"
        },
        {
            "classic_action": "",
            "command": "",
            "initial_value": false,
            "initialization_priority": -1,
            "inverted": false,
            "pin_number": "39"
        },
        {
            "classic_action": "",
            "command": "",
            "initial_value": false,
            "initialization_priority": -1,
            "inverted": false,
            "pin_number": "46"
        },
        {
            "classic_action": "TAC_SDCARD_DISC",
            "command": "sdcard",
            "initial_value": false,
            "initialization_priority": -1,
            "inverted": false,
            "pin_number": "47"
        },
        {
            "classic_action": "",
            "command": "<type a command>",
            "initial_value": false,
            "initialization_priority": -1,
            "inverted": false,
            "pin_number": "48"
        },
        {
            "classic_action": "",
            "command": "<type a command>",
            "initial_value": false,
            "initialization_priority": -1,
            "inverted": false,
            "pin_number": "49"
        },
        {
            "classic_action": "TAC_TC_START",
            "command": "pkey",
            "initial_value": false,
            "initialization_priority": -1,
            "inverted": false,
            "pin_number": "50"
        },
        {
            "classic_action": "TAC_RESET_PRI",
            "command": "voldn",
            "initial_value": false,
            "initialization_priority": -1,
            "inverted": false,
            "pin_number": "51"
        },
        {
            "classic_action": "TAC_POWER_OFF",
            "command": "battery",
            "initial_value": false,
            "initialization_priority": 2,
            "inverted": true,
            "pin_number": "53"
        },
        {
            "classic_action": "TAC_SW_DWNLD_PRI",
            "command": "pedl",
            "initial_value": false,
            "initialization_priority": -1,
            "inverted": false,
            "pin_number": "54"
        },
        {
            "classic_action": "TAC_USB0_DIS",
            "command": "usb0",
            "initial_value": false,
            "initialization_priority": 2,
            "inverted": true,
            "pin_number": "55"
        }
    ],
    "platform_id": 82,
    "platform_type": "PSOC",
    "reset_enabled": false,
    "schema_version": "1.0",
    "script": "def powerOffTheDevice() \r\n\tlogComment ====== powerOffTheDevice sequence start ======\r\n\r\n\tbattery 1\r\n\tusb0 1\r\n\tusb1 1\r\n\r\n\tlogComment ====== powerOffTheDevice sequence finish ======\r\n\r\ndef powerOnTheDevice()\r\n\tlogComment ====== powerOnTheDevice sequence start ======\r\n\r\n\tdelay 500\r\n\tbattery 0\r\n\tdelay 900\r\n\tusb0 0\r\n\tusb1 0\r\n\tdelay 30\r\n\r\n\tlogComment ====== powerOnTheDevice sequence finish ======\r\n\r\ndef powerOff()\r\n\tlogComment ====== powerOff start ======\r\n\r\n\tpowerOffTheDevice\r\n\r\n\tpkey 0\r\n\tvolup 0\r\n\tvoldn 0\r\n\r\n\tpedl 0\r\n\r\n\tlogComment ====== powerOff finish ======\r\n\r\ndef powerOn()\r\n\tlogComment ====== powerOn start ======\r\n\r\n\tpowerOff\r\n\r\n\tpowerOnTheDevice\r\n\r\n\tpkey 1\r\n\tdelay 800\r\n\tpkey 0\r\n\r\n\tlogComment ====== powerOn finish ======\r\n\r\ndef bootToEDL()\r\n\tlogComment ====== bootToEDL start ======\r\n\r\n\tpowerOffTheDevice\r\n\r\n\tpkey 0\r\n\tvolup 0\r\n\tvoldn 0\r\n\r\n\tpedl 1\r\n\r\n\tpowerOnTheDevice\r\n\r\n\tpkey 1\r\n\tdelay $edl\r\n\tpkey 0\r\n\r\n\tpedl 0\r\n\r\n\tlogComment ====== bootToEDL finish ======\r\n\r\ndef bootToSecondaryEDL()\r\n\tlogComment ====== bootToSecondaryEDL start ======\r\n\r\n\tpowerOffTheDevice\r\n\r\n\tpkey 0\r\n\tvolup 0\r\n\tvoldn 0\r\n\r\n\tsedl 1\r\n\r\n\tpowerOnTheDevice\r\n\r\n\tpkey 1\r\n\tdelay 800\r\n\tpkey 0\r\n\r\n\tdelay 1300\r\n\r\n\tsedl 0\r\n\r\n\tlogComment ====== bootToSecondaryEDL finish ======\r\n\r\ndef bootToUEFI()\r\n\tlogComment ====== bootToUEFIMenu start ======\r\n\r\n\tpowerOffTheDevice\r\n\r\n\t// Put buttons in a set state\r\n\tpkey 0\r\n\tvolup 1\r\n\tvoldn 0\r\n\r\n\tpedl 0\r\n\r\n\tpowerOnTheDevice\r\n\r\n\tpkey 1\r\n\tdelay $uefi\r\n\tpkey 0\r\n\tvolup 0\r\n\tdelay 12\r\n\tpkey 1\r\n\tvolup 1\r\n\r\n\tpkey 0\r\n\tvolup 0\r\n\r\n\tlogComment ====== bootToUEFIMenu finish ======\r\n\r\ndef bootToFastboot()\r\n\tlogComment ====== bootToFastboot start ======\r\n\r\n\tpowerOffTheDevice\r\n\r\n\tpkey 0\r\n\tvolup 0\r\n\tvoldn 1\r\n\r\n\tpedl 0\r\n\r\n\tpowerOnTheDevice\r\n\r\n\tpkey 1\r\n\tdelay 800\r\n\tpkey 0\r\n\r\n\tdelay $fastboot\r\n\tvoldn 0\r\n\tdelay 30\r\n\tvoldn 1\r\n\r\n\tvoldn 0\r\n\r\n\tlogComment ====== bootToFastboot finished ======\r\n",
    "supportedFirmwareVer": [
        15,
        18,
        19
    ],
    "usb_descriptor": "",
    "variables": [
        {
            "default_value": "1300",
            "name": "edl"
        },
        {
            "default_value": "8000",
            "name": "fastboot"
        },
        {
            "default_value": "8000",
            "name": "uefi"
        }
    ]
}
