{
    "$schema": "https://qualcomm.github.io/tac/schemas/pinout-1.0.json",
    "description": "Hawi MTP8975 - PSoC",
    "format": "tac-pinout",
    "name": "Hawi MTP8975",
    "pins": [
        {
            "classic_action": "TAC_SOFT_RESET",
            "command": "<type a command>",
            "initial_value": false,
            "initialization_priority": -1,
            "inverted": false,
            "pin_number": "15"
        },
        {
            "classic_action": "TC_EUD_EARLY_BOOT_EN",
            "command": "eud",
            "initial_value": false,
            "initialization_priority": -1,
            "inverted": false,
            "pin_number": "16"
        },
        {
            "classic_action": "TAC_UIM1_DIS",
            "command": "uim1",
            "initial_value": false,
            "initialization_priority": -1,
            "inverted": false,
            "pin_number": "18"
        },
        {
            "classic_action": "TAC_UIM2_DIS",
            "command": "uim2",
            "initial_value": false,
            "initialization_priority": -1,
            "inverted": false,
            "pin_number": "19"
        },
        {
            "classic_action": "TAC_HEADSET_DIS",
            "command": "<type a command>",
            "initial_value": false,
            "initialization_priority": -1,
            "inverted": false,
            "pin_number": "21"
        },
        {
            "classic_action": "",
            "command": "<type a command>",
            "initial_value": false,
            "initialization_priority": -1,
            "inverted": false,
            "pin_number": "29"
        },
        {
            "classic_action": "TAC_FORCE_USB_BOOT_SEC",
            "command": "<type a command>",
            "initial_value": false,
            "initialization_priority": -1,
            "inverted": false,
            "pin_number": "30"
        },
        {
            "classic_action": "TAC_RESET_SEC",
            "command": "<type a command>",
            "initial_value": false,
            "initialization_priority": -1,
            "inverted": false,
            "pin_number": "31"
        },
        {
            "classic_action": "TAC_VOL_UP",
            "command": "volup",
            "initial_value": false,
            "initialization_priority": -1,
            "inverted": false,
            "pin_number": "34"
        },
        {
            "classic_action": "TAC_USB1_DIS",
            "command": "<type a command>",
            "initial_value": false,
            "initialization_priority": -1,
            "inverted": false,
            "pin_number": "36"
        },
        {
            "classic_action": "TAC_FORCE_PS_HOLD",
            "command": "pshold",
            "initial_value": false,
            "initialization_priority": -1,
            "inverted": false,
            "pin_number": "37"
        },
        {
            "classic_action": "",
            "command": "",
            "initial_value": false,
            "initialization_priority": -1,
            "inverted": false,
            "pin_number": "38"
        },
        {
            "classic_action": "",
            "command": "msmreset",
            "initial_value": false,
            "initialization_priority": -1,
            "inverted": false,
            "pin_number": "39"
        },
        {
            "classic_action": "",
            "command": "rcmsel",
            "initial_value": false,
            "initialization_priority": -1,
            "inverted": false,
            "pin_number": "46"
        },
        {
            "classic_action": "TAC_SDCARD_DISC",
            "command": "sdcard",
            "initial_value": false,
            "initialization_priority": -1,
            "inverted": false,
            "pin_number": "47"
        },
        {
            "classic_action": "",
            "command": "headset",
            "initial_value": false,
            "initialization_priority": -1,
            "inverted": false,
            "pin_number": "48"
        },
        {
            "classic_action": "",
            "command": "msmreset",
            "initial_value": false,
            "initialization_priority": -1,
            "inverted": false,
            "pin_number": "49"
        },
        {
            "classic_action": "TAC_TC_START",
            "command": "pkey",
            "initial_value": false,
            "initialization_priority": -1,
            "inverted": false,
            "pin_number": "50"
        },
        {
            "classic_action": "TAC_RESET_PRI",
            "command": "voldn",
            "initial_value": false,
            "initialization_priority": -1,
            "inverted": false,
            "pin_number": "51"
        },
        {
            "classic_action": "TAC_POWER_OFF",
            "command": "battery",
            "initial_value": false,
            "initialization_priority": 2,
            "inverted": true,
            "pin_number": "53"
        },
        {
            "classic_action": "TAC_SW_DWNLD_PRI",
            "command": "pedl",
            "initial_value": false,
            "initialization_priority": -1,
            "inverted": false,
            "pin_number": "54"
        },
        {
            "classic_action": "TAC_USB0_DIS",
            "command": "usb0",
            "initial_value": false,
            "initialization_priority": 2,
            "inverted": true,
            "pin_number": "55"
        }
    ],
    "platform_id": 66,
    "platform_type": "PSOC",
    "reset_enabled": false,
    "schema_version": "1.0",
    "script": "def powerOffTheDevice() \n\tlogComment ====== powerOffTheDevice sequence start ======\n\n\tbattery 1\n\tusb0 1\n\n\tlogComment ====== powerOffTheDevice sequence finish ======\n\ndef powerOnTheDevice()\n\tlogComment ====== powerOnTheDevice sequence start ======\n\n\tdelay 500\n\tbattery 0\n\tdelay 900\n\tusb0 0\n\tdelay 30\n\n\tlogComment ====== powerOnTheDevice sequence finish ======\n\ndef powerOff()\n\tlogComment ====== powerOff start ======\n\n\tpowerOffTheDevice\n\n\tpkey 0\n\tvolup 0\n\tvoldn 0\n\n\tpedl 0\n\n\tlogComment ====== powerOff finish ======\n\ndef powerOn()\n\tlogComment ====== powerOn start ======\n\n\tpowerOff\n\n\tpowerOnTheDevice\n\n\tpkey 1\n\tdelay 800\n\tpkey 0\n\n\tlogComment ====== powerOn finish ======\n\ndef bootToEDL()\n\tlogComment ====== bootToEDL start ======\n\n\tpowerOffTheDevice\n\n\tpkey 0\n\tvolup 0\n\tvoldn 0\n\n\tpedl 1\n\n\tpowerOnTheDevice\n\n\tpkey 1\n\tdelay $edl\n\tpkey 0\n\n\tpedl 0\n\n\tlogComment ====== bootToEDL finish ======\n\ndef bootToSecondaryEDL()\n\tlogComment ====== bootToSecondaryEDL start ======\n\n\tpowerOffTheDevice\n\n\tpkey 0\n\tvolup 0\n\tvoldn 0\n\n\tsedl 1\n\n\tpowerOnTheDevice\n\n\tpkey 1\n\tdelay 800\n\tpkey 0\n\n\tdelay 1300\n\n\tsedl 0\n\n\tlogComment ====== bootToSecondaryEDL finish ======\n\ndef bootToBatteryEDL()\n\tlogComment ====== bootToBatteryEDL start ======\n\t\n\tpedl 1 //set EDL high\n\tvoldn 1 //reset MTP after 115 seconds\n\tdelay 14000\n\n\tpkey 1\n\tdelay 1300\n\tpkey 0\n\t\n\t//reset buttons\n\tdelay 6000\n\tvoldn 0 \n\tpedl 0\n\n\tlogComment ====== bootToBatteryEDL finish ======\n\ndef bootToUEFI()\n\tlogComment ====== bootToUEFIMenu start ======\n\n\tpowerOffTheDevice\n\n\t// Put buttons in a set state\n\tpkey 0\n\tvolup 1\n\tvoldn 0\n\n\tpedl 0\n\n\tpowerOnTheDevice\n\n\tpkey 1\n\tdelay $uefi\n\tpkey 0\n\tvolup 0\n\tdelay 12\n\tpkey 1\n\tvolup 1\n\n\tpkey 0\n\tvolup 0\n\n\tlogComment ====== bootToUEFIMenu finish ======\n\ndef bootToFastboot()\n\tlogComment ====== bootToFastboot start ======\n\n\tpowerOffTheDevice\n\n\tpkey 0\n\tvolup 0\n\tvoldn 1\n\n\tpedl 0\n\n\tpowerOnTheDevice\n\n\tpkey 1\n\tdelay 800\n\tpkey 0\n\n\tdelay $fastboot\n\tvoldn 0\n\tdelay 30\n\tvoldn 1\n\n\tvoldn 0\n\n\tlogComment ====== bootToFastboot finished ======\n\ndef batteryReset()\n\tlogComment ====== batteryReset ======\n\t\n\tpedl 0 //reset EDL\n\tvoldn 1 //reset MTP after 14 seconds\n\tdelay 14000\n\n\tpkey 1\n\tdelay 1300\n\tpkey 0\n\n\tdelay 6000\n\tvoldn 0 //release voldn to stop MTP reset\n\n\tlogComment ======  batteryReset ======",
    "supportedFirmwareVer": [
        17
    ],
    "usb_descriptor": "",
    "variables": [
        {
            "default_value": "1300",
            "name": "edl"
        },
        {
            "default_value": "8000",
            "name": "fastboot"
        },
        {
            "default_value": "8000",
            "name": "uefi"
        }
    ]
}
