{
    "$schema": "https://qualcomm.github.io/tac/schemas/pinout-1.0.json",
    "bus": [
        {
            "bus": "C",
            "bus_function": 2,
            "chip_index": 0
        },
        {
            "bus": "D",
            "bus_function": 1,
            "chip_index": 0
        }
    ],
    "chip_count": 1,
    "description": "Arduino Ventuno Q",
    "format": "tac-pinout",
    "name": "Arduino Ventuno Q",
    "pins": [
        {
            "bus": "C",
            "chip_index": 0,
            "command": "edl",
            "initial_value": false,
            "input": false,
            "inverted": false,
            "pin_number": "0",
            "priority": 0
        },
        {
            "bus": "D",
            "chip_index": 0,
            "command": "",
            "initial_value": false,
            "input": false,
            "inverted": false,
            "pin_number": "0",
            "priority": -1
        },
        {
            "bus": "C",
            "chip_index": 0,
            "command": "pkey",
            "initial_value": false,
            "input": false,
            "inverted": false,
            "pin_number": "1",
            "priority": 0
        },
        {
            "bus": "D",
            "chip_index": 0,
            "command": "",
            "initial_value": false,
            "input": false,
            "inverted": false,
            "pin_number": "1",
            "priority": -1
        },
        {
            "bus": "C",
            "chip_index": 0,
            "command": "battery",
            "initial_value": false,
            "input": false,
            "inverted": false,
            "pin_number": "2",
            "priority": 1
        },
        {
            "bus": "D",
            "chip_index": 0,
            "command": "",
            "initial_value": false,
            "input": false,
            "inverted": false,
            "pin_number": "2",
            "priority": -1
        },
        {
            "bus": "C",
            "chip_index": 0,
            "command": "",
            "initial_value": false,
            "input": false,
            "inverted": false,
            "pin_number": "3",
            "priority": -1
        },
        {
            "bus": "D",
            "chip_index": 0,
            "command": "",
            "initial_value": false,
            "input": false,
            "inverted": false,
            "pin_number": "3",
            "priority": -1
        },
        {
            "bus": "C",
            "chip_index": 0,
            "command": "",
            "initial_value": false,
            "input": false,
            "inverted": false,
            "pin_number": "4",
            "priority": -1
        },
        {
            "bus": "D",
            "chip_index": 0,
            "command": "",
            "initial_value": false,
            "input": false,
            "inverted": false,
            "pin_number": "4",
            "priority": -1
        },
        {
            "bus": "C",
            "chip_index": 0,
            "command": "",
            "initial_value": false,
            "input": false,
            "inverted": false,
            "pin_number": "5",
            "priority": -1
        },
        {
            "bus": "D",
            "chip_index": 0,
            "command": "",
            "initial_value": false,
            "input": false,
            "inverted": false,
            "pin_number": "5",
            "priority": -1
        },
        {
            "bus": "C",
            "chip_index": 0,
            "command": "",
            "initial_value": false,
            "input": false,
            "inverted": false,
            "pin_number": "6",
            "priority": -1
        },
        {
            "bus": "D",
            "chip_index": 0,
            "command": "",
            "initial_value": false,
            "input": false,
            "inverted": false,
            "pin_number": "6",
            "priority": -1
        },
        {
            "bus": "C",
            "chip_index": 0,
            "command": "",
            "initial_value": false,
            "input": false,
            "inverted": false,
            "pin_number": "7",
            "priority": -1
        },
        {
            "bus": "D",
            "chip_index": 0,
            "command": "",
            "initial_value": false,
            "input": false,
            "inverted": false,
            "pin_number": "7",
            "priority": -1
        }
    ],
    "platform_id": 81,
    "platform_type": "FT232H",
    "reset_enabled": false,
    "schema_version": "1.0",
    "script": "def powerOff()\n\tlogComment ====== powerOff sequence start ======\n\tbattery 1\n\tlogComment ====== powerOff sequence finish ======\n\ndef powerOn()\n\tlogComment ====== powerOn sequence start ======\n\tpowerOff\n\tdelay $pon\n\tedl 0\n\tbattery 0\n\tlogComment ====== powerOn sequence finish ======\n\ndef bootToEDL()\n\tlogComment ====== bootToEDL sequence start ======\n\tpowerOff\n\tdelay $edl\n\tedl 1\n\tbattery 0\n\tlogComment ====== bootToEDL sequence finish ======",
    "usb_descriptor": "VentunoQ BugHopper",
    "variables": [
        {
            "default_value": "100",
            "name": "edl"
        },
        {
            "default_value": "100",
            "name": "pon"
        }
    ]
}
