{
    "$schema": "https://qualcomm.github.io/tac/schemas/pinout-1.0.json",
    "description": "RB5 ",
    "format": "tac-pinout",
    "name": "RB5",
    "pins": [
        {
            "classic_action": "TAC_SOFT_RESET",
            "command": "",
            "initial_value": false,
            "initialization_priority": -1,
            "inverted": false,
            "pin_number": "15"
        },
        {
            "classic_action": "TC_EUD_EARLY_BOOT_EN",
            "command": "eud",
            "initial_value": false,
            "initialization_priority": -1,
            "inverted": false,
            "pin_number": "16"
        },
        {
            "classic_action": "TAC_UIM1_DIS",
            "command": "uim1",
            "initial_value": false,
            "initialization_priority": -1,
            "inverted": false,
            "pin_number": "18"
        },
        {
            "classic_action": "TAC_UIM2_DIS",
            "command": "uim2",
            "initial_value": false,
            "initialization_priority": -1,
            "inverted": false,
            "pin_number": "19"
        },
        {
            "classic_action": "TAC_HEADSET_DIS",
            "command": "headset",
            "initial_value": false,
            "initialization_priority": -1,
            "inverted": false,
            "pin_number": "21"
        },
        {
            "classic_action": "",
            "command": "",
            "initial_value": false,
            "initialization_priority": -1,
            "inverted": false,
            "pin_number": "29"
        },
        {
            "classic_action": "TAC_FORCE_USB_BOOT_SEC",
            "command": "sedl",
            "initial_value": false,
            "initialization_priority": -1,
            "inverted": false,
            "pin_number": "30"
        },
        {
            "classic_action": "TAC_RESET_SEC",
            "command": "sresn",
            "initial_value": false,
            "initialization_priority": -1,
            "inverted": false,
            "pin_number": "31"
        },
        {
            "classic_action": "TAC_VOL_UP",
            "command": "volup",
            "initial_value": false,
            "initialization_priority": -1,
            "inverted": false,
            "pin_number": "34"
        },
        {
            "classic_action": "TAC_USB1_DIS",
            "command": "usb1",
            "initial_value": false,
            "initialization_priority": 2,
            "inverted": true,
            "pin_number": "36"
        },
        {
            "classic_action": "TAC_FORCE_PS_HOLD",
            "command": "pshold",
            "initial_value": false,
            "initialization_priority": -1,
            "inverted": false,
            "pin_number": "37"
        },
        {
            "classic_action": "",
            "command": "",
            "initial_value": false,
            "initialization_priority": -1,
            "inverted": false,
            "pin_number": "38"
        },
        {
            "classic_action": "",
            "command": "",
            "initial_value": false,
            "initialization_priority": -1,
            "inverted": false,
            "pin_number": "39"
        },
        {
            "classic_action": "",
            "command": "",
            "initial_value": false,
            "initialization_priority": -1,
            "inverted": false,
            "pin_number": "46"
        },
        {
            "classic_action": "TAC_SDCARD_DISC",
            "command": "sdcard",
            "initial_value": false,
            "initialization_priority": -1,
            "inverted": false,
            "pin_number": "47"
        },
        {
            "classic_action": "TAC_TC_START",
            "command": "pkey",
            "initial_value": false,
            "initialization_priority": -1,
            "inverted": false,
            "pin_number": "50"
        },
        {
            "classic_action": "TAC_RESET_PRI",
            "command": "voldn",
            "initial_value": false,
            "initialization_priority": -1,
            "inverted": false,
            "pin_number": "51"
        },
        {
            "classic_action": "TAC_POWER_OFF",
            "command": "battery",
            "initial_value": false,
            "initialization_priority": 2,
            "inverted": true,
            "pin_number": "53"
        },
        {
            "classic_action": "TAC_SW_DWNLD_PRI",
            "command": "pedl",
            "initial_value": false,
            "initialization_priority": -1,
            "inverted": false,
            "pin_number": "54"
        },
        {
            "classic_action": "TAC_USB0_DIS",
            "command": "usb0",
            "initial_value": false,
            "initialization_priority": 2,
            "inverted": true,
            "pin_number": "55"
        }
    ],
    "platform_id": 35,
    "platform_type": "PSOC",
    "reset_enabled": true,
    "schema_version": "1.0",
    "script": "def powerOffTheDevice() \n\tlogComment ====== powerOffTheDevice sequence start ======\n\n\tbattery 1\n\tusb0 1\n\tusb1 1\n\n\tlogComment ====== powerOffTheDevice sequence finish ======\n\ndef powerOnTheDevice()\n\tlogComment ====== powerOnTheDevice sequence start ======\n\n\tdelay 500\n\tbattery 0\n\tdelay 900\n\tusb0 0\n\tusb1 0\n\tdelay 30\n\n\tlogComment ====== powerOnTheDevice sequence finish ======\n\ndef powerOff()\n\tlogComment ====== powerOff start ======\n\n\tpowerOffTheDevice\n\n\tpkey 0\n\tvolup 0\n\tvoldn 0\n\n\tpedl 0\n\n\tlogComment ====== powerOff finish ======\n\ndef powerOn()\n\tlogComment ====== powerOn start ======\n\t\n\tpowerOnTheDevice\n\t\n\tdelay 30\n\n\tpkey 1\n\tdelay $powerDelay\n\tpkey 0\n\tlogComment ====== powerOn finish ======\n\n\ndef bootToEDL()\n\tlogComment ====== bootToEDL start ======\n\n\t\n\tpkey 0\n\tvolup 0\n\tvoldn 0\n\n\tpedl 1\n\n\tpkey 1\n\tdelay $edl\n\tpkey 0\n\n\tpedl 0\n\n\tlogComment ====== bootToEDL finish ======\n\ndef bootToSecondaryEDL()\n\tlogComment ====== bootToSecondaryEDL start ======\n\n\tpowerOffTheDevice\n\n\tpkey 0\n\tvolup 0\n\tvoldn 0\n\n\tsedl 1\n\n\tpowerOnTheDevice\n\n\tpkey 1\n\tdelay 800\n\tpkey 0\n\n\tdelay 1300\n\n\tsedl 0\n\n\tlogComment ====== bootToSecondaryEDL finish ======\n\ndef bootToUEFI()\n\tlogComment ====== bootToUEFIMenu start ======\n\n\tpowerOffTheDevice\n\n\t// Put buttons in a set state\n\tpkey 0\n\tvolup 1\n\tvoldn 0\n\n\tpedl 0\n\n\tpowerOnTheDevice\n\n\tpkey 1\n\tdelay 8000\n\tpkey 0\n\tvolup 0\n\tdelay 12\n\tpkey 1\n\tvolup 1\n\n\tpkey 0\n\tvolup 0\n\n\tlogComment ====== bootToUEFIMenu finish ======\n\ndef bootToFastboot()\n\tlogComment ====== bootToFastboot start ======\n\n\tpowerOnTheDevice\n\n\tpkey 1\n\tdelay 800\n\tvoldn 1\n\n\tdelay $fastboot1\n\n\tpkey 0\n\n\tdelay $fastboot2\n\n\tvoldn 0\n\t\n\tlogComment ====== bootToFastboot finished ======\n",
    "supportedFirmwareVer": [
        15
    ],
    "usb_descriptor": "",
    "variables": [
        {
            "default_value": "20000",
            "name": "edl"
        },
        {
            "default_value": "10000",
            "name": "fastboot1"
        },
        {
            "default_value": "10000",
            "name": "fastboot2"
        },
        {
            "default_value": "18000",
            "name": "powerDelay"
        }
    ]
}
